{
  "capabilities": [
    {
      "accountScoped": "all-accounts-read",
      "agenticAccountRequired": false,
      "currentlyDocumented": true,
      "descriptionStatus": "VERIFIED",
      "families": ["account_read"],
      "freshness": {
        "note": "No documented freshness guarantee; render an as-of age and never claim real-time.",
        "status": "UNKNOWN"
      },
      "group": "account_portfolio_other",
      "id": "tool.get_accounts",
      "inputSchemaStatus": "UNKNOWN",
      "limitations": [
        "Input/output schema UNKNOWN (auth-walled) — discover via tools/list at session time and validate before every call.",
        "Read spans ALL Robinhood accounts; runtime MUST pin/filter to the granted account fingerprint before rendering."
      ],
      "livePolicy": "READ-ALLOWED in the user's session; HISS-hosted services never call it",
      "mustBeGated": "no",
      "officialDescription": "View all your Robinhood accounts",
      "outputSchemaStatus": "UNKNOWN",
      "pagination": {
        "note": "Pagination grammar undocumented (auth-walled). Assume cursors may exist; never assume a page returns the full set.",
        "status": "UNKNOWN"
      },
      "rateLimit": {
        "payloadCap": "UNKNOWN",
        "requestRate": "UNKNOWN — undisclosed; conservative self-budget + trades/day fuse + 429 backoff."
      },
      "retryPolicy": {
        "idempotency": "n/a (read/simulate)",
        "onAmbiguousFailure": "safe to retry with backoff.",
        "retrySafe": "yes (read/simulate; no observed side effect for reads)"
      },
      "riskClass": "read",
      "schemaDiscovered": false,
      "supportedAssetClasses": ["equity"],
      "supportedOrderTypes": [],
      "supportedTif": [],
      "toolName": "get_accounts"
    },
    {
      "accountScoped": "all-accounts-read",
      "agenticAccountRequired": false,
      "currentlyDocumented": true,
      "descriptionStatus": "VERIFIED",
      "families": ["account_read"],
      "freshness": {
        "note": "Officially described as real-time / live.",
        "status": "VERIFIED"
      },
      "group": "account_portfolio_other",
      "id": "tool.get_portfolio",
      "inputSchemaStatus": "UNKNOWN",
      "limitations": [
        "Input/output schema UNKNOWN (auth-walled) — discover via tools/list at session time and validate before every call.",
        "Read spans ALL Robinhood accounts; runtime MUST pin/filter to the granted account fingerprint before rendering."
      ],
      "livePolicy": "READ-ALLOWED in the user's session; HISS-hosted services never call it",
      "mustBeGated": "no",
      "officialDescription": "Get a snapshot of your portfolio, including total value, values by asset class, and real-time buying power",
      "outputSchemaStatus": "UNKNOWN",
      "pagination": {
        "note": "Pagination grammar undocumented (auth-walled). Assume cursors may exist; never assume a page returns the full set.",
        "status": "UNKNOWN"
      },
      "rateLimit": {
        "payloadCap": "UNKNOWN",
        "requestRate": "UNKNOWN — undisclosed; conservative self-budget + trades/day fuse + 429 backoff."
      },
      "retryPolicy": {
        "idempotency": "n/a (read/simulate)",
        "onAmbiguousFailure": "safe to retry with backoff.",
        "retrySafe": "yes (read/simulate; no observed side effect for reads)"
      },
      "riskClass": "read",
      "schemaDiscovered": false,
      "supportedAssetClasses": ["equity"],
      "supportedOrderTypes": [],
      "supportedTif": [],
      "toolName": "get_portfolio"
    },
    {
      "accountScoped": "all-accounts-read",
      "agenticAccountRequired": false,
      "currentlyDocumented": true,
      "descriptionStatus": "VERIFIED",
      "families": ["account_read"],
      "freshness": {
        "note": "No documented freshness guarantee; render an as-of age and never claim real-time.",
        "status": "UNKNOWN"
      },
      "group": "account_portfolio_other",
      "id": "tool.get_realized_pnl",
      "inputSchemaStatus": "UNKNOWN",
      "limitations": [
        "Input/output schema UNKNOWN (auth-walled) — discover via tools/list at session time and validate before every call.",
        "Read spans ALL Robinhood accounts; runtime MUST pin/filter to the granted account fingerprint before rendering."
      ],
      "livePolicy": "READ-ALLOWED in the user's session; HISS-hosted services never call it",
      "mustBeGated": "no",
      "officialDescription": "View realized profit and loss for your account over a custom time window, broken down by asset class",
      "outputSchemaStatus": "UNKNOWN",
      "pagination": {
        "note": "Pagination grammar undocumented (auth-walled). Assume cursors may exist; never assume a page returns the full set.",
        "status": "UNKNOWN"
      },
      "rateLimit": {
        "payloadCap": "UNKNOWN",
        "requestRate": "UNKNOWN — undisclosed; conservative self-budget + trades/day fuse + 429 backoff."
      },
      "retryPolicy": {
        "idempotency": "n/a (read/simulate)",
        "onAmbiguousFailure": "safe to retry with backoff.",
        "retrySafe": "yes (read/simulate; no observed side effect for reads)"
      },
      "riskClass": "read",
      "schemaDiscovered": false,
      "supportedAssetClasses": ["equity"],
      "supportedOrderTypes": [],
      "supportedTif": [],
      "toolName": "get_realized_pnl"
    },
    {
      "accountScoped": "all-accounts-read",
      "agenticAccountRequired": false,
      "currentlyDocumented": true,
      "descriptionStatus": "VERIFIED",
      "families": ["account_read"],
      "freshness": {
        "note": "No documented freshness guarantee; render an as-of age and never claim real-time.",
        "status": "UNKNOWN"
      },
      "group": "account_portfolio_other",
      "id": "tool.get_pnl_trade_history",
      "inputSchemaStatus": "UNKNOWN",
      "limitations": [
        "Input/output schema UNKNOWN (auth-walled) — discover via tools/list at session time and validate before every call.",
        "Read spans ALL Robinhood accounts; runtime MUST pin/filter to the granted account fingerprint before rendering."
      ],
      "livePolicy": "DENIED — not in the shipped allowlist; AGENTIC_NEW_TOOL_ADOPTION.adopted=false (RISK-1)",
      "mustBeGated": "no",
      "officialDescription": "View your trade-by-trade realized P&L history",
      "outputSchemaStatus": "UNKNOWN",
      "pagination": {
        "note": "Pagination grammar undocumented (auth-walled). Assume cursors may exist; never assume a page returns the full set.",
        "status": "UNKNOWN"
      },
      "rateLimit": {
        "payloadCap": "UNKNOWN",
        "requestRate": "UNKNOWN — undisclosed; conservative self-budget + trades/day fuse + 429 backoff."
      },
      "retryPolicy": {
        "idempotency": "n/a (read/simulate)",
        "onAmbiguousFailure": "safe to retry with backoff.",
        "retrySafe": "yes (read/simulate; no observed side effect for reads)"
      },
      "riskClass": "read",
      "schemaDiscovered": false,
      "supportedAssetClasses": ["equity"],
      "supportedOrderTypes": [],
      "supportedTif": [],
      "toolName": "get_pnl_trade_history"
    },
    {
      "accountScoped": "market-global",
      "agenticAccountRequired": false,
      "currentlyDocumented": true,
      "descriptionStatus": "VERIFIED",
      "families": ["market_read"],
      "freshness": {
        "note": "No documented freshness guarantee; render an as-of age and never claim real-time.",
        "status": "UNKNOWN"
      },
      "group": "account_portfolio_other",
      "id": "tool.search",
      "inputSchemaStatus": "UNKNOWN",
      "limitations": [
        "Input/output schema UNKNOWN (auth-walled) — discover via tools/list at session time and validate before every call."
      ],
      "livePolicy": "READ-ALLOWED in the user's session; HISS-hosted services never call it",
      "mustBeGated": "no",
      "officialDescription": "Find a company name or partial name to a ticker",
      "outputSchemaStatus": "UNKNOWN",
      "pagination": {
        "note": "Pagination grammar undocumented (auth-walled). Assume cursors may exist; never assume a page returns the full set.",
        "status": "UNKNOWN"
      },
      "rateLimit": {
        "payloadCap": "UNKNOWN",
        "requestRate": "UNKNOWN — undisclosed; conservative self-budget + trades/day fuse + 429 backoff."
      },
      "retryPolicy": {
        "idempotency": "n/a (read/simulate)",
        "onAmbiguousFailure": "safe to retry with backoff.",
        "retrySafe": "yes (read/simulate; no observed side effect for reads)"
      },
      "riskClass": "read",
      "schemaDiscovered": false,
      "supportedAssetClasses": ["equity"],
      "supportedOrderTypes": [],
      "supportedTif": [],
      "toolName": "search"
    },
    {
      "accountScoped": "all-accounts-read",
      "agenticAccountRequired": false,
      "currentlyDocumented": true,
      "descriptionStatus": "VERIFIED",
      "families": ["watchlists"],
      "freshness": {
        "note": "No documented freshness guarantee; render an as-of age and never claim real-time.",
        "status": "UNKNOWN"
      },
      "group": "watchlist",
      "id": "tool.get_watchlists",
      "inputSchemaStatus": "UNKNOWN",
      "limitations": [
        "Input/output schema UNKNOWN (auth-walled) — discover via tools/list at session time and validate before every call.",
        "Read spans ALL Robinhood accounts; runtime MUST pin/filter to the granted account fingerprint before rendering."
      ],
      "livePolicy": "READ-ALLOWED in the user's session; HISS-hosted services never call it",
      "mustBeGated": "no",
      "officialDescription": "List user’s watchlists",
      "outputSchemaStatus": "UNKNOWN",
      "pagination": {
        "note": "Pagination grammar undocumented (auth-walled). Assume cursors may exist; never assume a page returns the full set.",
        "status": "UNKNOWN"
      },